Objective,Icon,Description
Destroy the portals!,,Agent 8 must destroy all Jelleton portals found on a given floor.
Defeat the fleeing foes!,,Agent 8 must pursue and defeat Panicking Alla Mambos that flee from them.
Sink the ∞-balls!,,Agent 8 must guide one or more ∞-balls; this mode is similar to Octo Expansion's 8-ball stations.
Protect the zones!,,Agent 8 must keep one or two zones inked for a timed duration while Jelletons attempt to attack and claim the Zone.
Escort the turbine tower!,,Agent 8 must ink a turbine tower to move it along its fixed path; this mode is similar to Tower Control.
